{
  "id": "solo_a_pose_relaxed_v1",
  "name": { "vi": "Đứng thư giãn dáng chữ A", "en": "Relaxed A-pose standing" },
  "peopleCount": 1,
  "shotTypes": ["HALF_BODY", "THREE_QUARTER", "FULL_BODY"],
  "contextTags": ["indoor", "studio_plain", "outdoor", "home_interior"],
  "difficulty": "TRIVIAL",
  "mirrorAllowed": true,
  "orientationExpectation": { "torsoYawDeg": 12, "toleranceDeg": 20 },
  "frame": {
    "cameraHeight": "CHEST",
    "cameraDistanceHint": "2.5-4 m",
    "headroomBand": [0.04, 0.20],
    "subjectHeightFraction": [0.35, 0.95]
  },
  "landmarks": [
    { "id": "nose",           "x":  0.00, "y": -1.45, "weight": 1.0, "required": true, "component": "HEAD" },
    { "id": "left_eye",       "x":  0.10, "y": -1.43, "weight": 0.6, "component": "HEAD" },
    { "id": "right_eye",      "x": -0.10, "y": -1.43, "weight": 0.6, "component": "HEAD" },
    { "id": "left_ear",       "x":  0.20, "y": -1.45, "weight": 0.5, "component": "HEAD" },
    { "id": "right_ear",      "x": -0.20, "y": -1.45, "weight": 0.5, "component": "HEAD" },
    { "id": "left_shoulder",  "x":  0.40, "y": -1.00, "weight": 1.0, "required": true, "component": "TORSO" },
    { "id": "right_shoulder", "x": -0.40, "y": -1.00, "weight": 1.0, "required": true, "component": "TORSO" },
    { "id": "left_elbow",     "x":  0.52, "y": -0.45, "weight": 0.9, "component": "LEFT_ARM" },
    { "id": "right_elbow",    "x": -0.52, "y": -0.45, "weight": 0.9, "component": "RIGHT_ARM" },
    { "id": "left_wrist",     "x":  0.56, "y":  0.08, "weight": 0.8, "component": "LEFT_ARM" },
    { "id": "right_wrist",    "x": -0.56, "y":  0.08, "weight": 0.8, "component": "RIGHT_ARM" },
    { "id": "left_hip",       "x":  0.28, "y":  0.00, "weight": 1.0, "required": true, "component": "TORSO" },
    { "id": "right_hip",      "x": -0.28, "y":  0.00, "weight": 1.0, "required": true, "component": "TORSO" },
    { "id": "left_knee",      "x":  0.28, "y":  0.90, "weight": 0.9, "component": "LEFT_LEG" },
    { "id": "right_knee",     "x": -0.28, "y":  0.90, "weight": 0.9, "component": "RIGHT_LEG" },
    { "id": "left_ankle",     "x":  0.28, "y":  1.76, "weight": 0.8, "component": "LEFT_LEG" },
    { "id": "right_ankle",    "x": -0.28, "y":  1.76, "weight": 0.8, "component": "RIGHT_LEG" },
    { "id": "left_heel",      "x":  0.28, "y":  1.83, "weight": 0.4, "component": "LEFT_LEG" },
    { "id": "right_heel",     "x": -0.28, "y":  1.83, "weight": 0.4, "component": "RIGHT_LEG" },
    { "id": "left_foot_index","x":  0.33, "y":  1.88, "weight": 0.5, "component": "LEFT_LEG" },
    { "id": "right_foot_index","x": -0.33,"y":  1.88, "weight": 0.5, "component": "RIGHT_LEG" }
  ],
  "jointAngles": [
    { "joint": "left_elbow",  "value": 165, "tolerance": 20, "weight": 0.8 },
    { "joint": "right_elbow", "value": 165, "tolerance": 20, "weight": 0.8 },
    { "joint": "left_knee",   "value": 172, "tolerance": 15, "weight": 0.5 },
    { "joint": "right_knee",  "value": 172, "tolerance": 15, "weight": 0.5 }
  ],
  "relativeVectors": [
    { "from": "left_shoulder",  "to": "left_elbow",  "dir": [0.27, 0.96], "weight": 0.8 },
    { "from": "right_shoulder", "to": "right_elbow", "dir": [-0.27, 0.96], "weight": 0.8 },
    { "from": "left_hip",       "to": "left_knee",   "dir": [0.00, 1.00], "weight": 0.6 },
    { "from": "right_hip",      "to": "right_knee",  "dir": [0.00, 1.00], "weight": 0.6 }
  ],
  "componentWeights": { "HEAD": 0.14, "TORSO": 0.26, "LEFT_ARM": 0.19, "RIGHT_ARM": 0.19, "LEFT_LEG": 0.11, "RIGHT_LEG": 0.11 },
  "bodyOrientation": { "shoulderAngleDeg": 0, "hipAngleDeg": 0, "facingDeg": 12 },
  "cameraRecommendations": ["CHEST_HEIGHT", "EYE_LEVEL"],
  "compositionRecommendations": ["EYES_UPPER_THIRD", "SUBJECT_HEIGHT_FRACTION_50_80"],
  "intentFlags": { "suppressSymmetryWarning": false, "suppressLockedJointWarning": true },
  "provenance": {
    "source": "craft consensus: relaxed standing, slight asymmetry, arm gap (docs/pose-taxonomy.md 2.2 / G3)",
    "status": "SEED_UNVALIDATED",
    "calibration": "verify that the matcher does not reject natural stances with proportion differences; adjust component weights in Phase 6",
    "author": "GitHub Agent",
    "date": "2026-10-02"
  }
}
